{
  "artifact_hash": "sha256:b448b689ebe77ad3a39b9c2fe19abe041b0a30b731d797bab7986932cfb83ea6",
  "artifact_kind": "persona_v3_ai_semantic_source_skeptic_review",
  "binding_checks": {
    "candidate_persona": {
      "detail": "extractor, acquisition, and skeptic catalog candidate/persona identities must match",
      "status": "pass"
    },
    "extracted_text": {
      "detail": "independent extraction hash, length, and page counts must match",
      "status": "pass"
    },
    "extractor_artifact": {
      "detail": "extractor artifact domain hash and structural validation must pass",
      "status": "pass"
    },
    "raw_bytes": {
      "detail": "source.bin byte length and SHA-256 must match acquisition and extractor bindings",
      "status": "pass"
    },
    "source_record": {
      "detail": "acquisition record canonical hash must match the extractor binding",
      "status": "pass"
    }
  },
  "candidate_id": "klarman_cfa_patient_investors_2010",
  "challenges": [
    "The archive exposes metadata and a short conference description but not the complete interview text.",
    "No proposition may be reconstructed from model memory or adjacent sources."
  ],
  "extractor_binding": {
    "artifact_content_hash": "sha256:d381c4a50654ac65cf371b23c8adaef8a952f452c14eed17b0e3b4d04be73fc4",
    "declared_artifact_hash": "sha256:8f9f0c83ecbff127c5e2f8ea051066b0a772153fe42add899aea2c5823cc2d71",
    "proposition_count": 0,
    "recomputed_artifact_hash": "sha256:8f9f0c83ecbff127c5e2f8ea051066b0a772153fe42add899aea2c5823cc2d71",
    "relative_path": "master_klarman/klarman_cfa_patient_investors_2010.json"
  },
  "human_reviewed": false,
  "method_attribution_approved": false,
  "model_identity": {
    "agent_task_id": "/root/ai_formula_review_lane",
    "exact_deployment_id": "not_exposed_to_agent",
    "model_family": "GPT-5",
    "product": "Codex collaborating agent",
    "provider": "OpenAI"
  },
  "open_questions": [
    "Can the original transcript, audio, readable PDF, or unobstructed page be archived and reviewed?"
  ],
  "overall_verdict": "unverifiable",
  "persona_id": "master_klarman",
  "pipeline_id": "alphacouncil_ai_semantic_source_skeptic_v1",
  "production_effect": "none",
  "prompt_identity": {
    "prompt_hash": "sha256:d24de73d6ec2305258b443de11570d1bd1feea4f15cdd0e21aa63c2a652539b9",
    "prompt_id": "alphacouncil.source-semantic-skeptic.round2.v1"
  },
  "proposition_reviews": [],
  "readability_recheck": {
    "extractor_status": "partial",
    "independent_status": "partial",
    "reason": "Independent extraction produced some text but no safely reviewable method proposition.",
    "status_match": true
  },
  "review_stage": "round_2_semantic_skeptic",
  "reviewed_on": "2026-07-27",
  "reviewer_kind": "ai",
  "role": "skeptic",
  "role_id": "ai_semantic_source_skeptic_v1",
  "schema_version": 1,
  "source_binding": {
    "byte_length": 49983,
    "content_hash": "sha256:48fbf1d4dda2df5b56d465f38332164d2edbd5f30b2a2222f46ff9617f7101d8",
    "extracted_text_hash": "sha256:3cb9155664a6c491d5ec16a5b4db58f141850f8bd1c50517501f553e4bc7e5b6",
    "extracted_text_hash_recomputed": "sha256:3cb9155664a6c491d5ec16a5b4db58f141850f8bd1c50517501f553e4bc7e5b6",
    "raw_bytes_hash_recomputed": "sha256:48fbf1d4dda2df5b56d465f38332164d2edbd5f30b2a2222f46ff9617f7101d8",
    "raw_bytes_reverified": true,
    "source_record_hash": "sha256:d595b237acd1f6c42f890413da4826f1d12292c1a0a534ff71e4af9c3c95919d",
    "source_record_hash_recomputed": "sha256:d595b237acd1f6c42f890413da4826f1d12292c1a0a534ff71e4af9c3c95919d"
  }
}
