{
  "artifact_hash": "sha256:d1a0893535907e5f8ce583c3749957586f1a0e72429e39b8c2807202adc8a6b3",
  "artifact_kind": "persona_v3_ai_semantic_source_skeptic_review",
  "binding_checks": {
    "candidate_persona": {
      "detail": "extractor, acquisition, and skeptic catalog candidate/persona identities must match",
      "status": "pass"
    },
    "extracted_text": {
      "detail": "independent extraction hash, length, and page counts must match",
      "status": "pass"
    },
    "extractor_artifact": {
      "detail": "extractor artifact domain hash and structural validation must pass",
      "status": "pass"
    },
    "raw_bytes": {
      "detail": "source.bin byte length and SHA-256 must match acquisition and extractor bindings",
      "status": "pass"
    },
    "source_record": {
      "detail": "acquisition record canonical hash must match the extractor binding",
      "status": "pass"
    }
  },
  "candidate_id": "simons_foundation_career_interview_2012",
  "challenges": [
    "The archive is a video landing page with chapter labels but no transcript of the interview.",
    "No proposition may be reconstructed from model memory or adjacent sources."
  ],
  "extractor_binding": {
    "artifact_content_hash": "sha256:9a2fd5fe68b9423245daf9c9a508affc77e34b11e709e5a79eef4a3241422d99",
    "declared_artifact_hash": "sha256:1a8f5d6473be090bcd3a1789adcfedf6ce8a38147d87ee10e0d79c4b1a5efefe",
    "proposition_count": 0,
    "recomputed_artifact_hash": "sha256:1a8f5d6473be090bcd3a1789adcfedf6ce8a38147d87ee10e0d79c4b1a5efefe",
    "relative_path": "master_simons/simons_foundation_career_interview_2012.json"
  },
  "human_reviewed": false,
  "method_attribution_approved": false,
  "model_identity": {
    "agent_task_id": "/root/ai_formula_review_lane",
    "exact_deployment_id": "not_exposed_to_agent",
    "model_family": "GPT-5",
    "product": "Codex collaborating agent",
    "provider": "OpenAI"
  },
  "open_questions": [
    "Can the original transcript, audio, readable PDF, or unobstructed page be archived and reviewed?"
  ],
  "overall_verdict": "unverifiable",
  "persona_id": "master_simons",
  "pipeline_id": "alphacouncil_ai_semantic_source_skeptic_v1",
  "production_effect": "none",
  "prompt_identity": {
    "prompt_hash": "sha256:d24de73d6ec2305258b443de11570d1bd1feea4f15cdd0e21aa63c2a652539b9",
    "prompt_id": "alphacouncil.source-semantic-skeptic.round2.v1"
  },
  "proposition_reviews": [],
  "readability_recheck": {
    "extractor_status": "partial",
    "independent_status": "partial",
    "reason": "Independent extraction produced some text but no safely reviewable method proposition.",
    "status_match": true
  },
  "review_stage": "round_2_semantic_skeptic",
  "reviewed_on": "2026-07-27",
  "reviewer_kind": "ai",
  "role": "skeptic",
  "role_id": "ai_semantic_source_skeptic_v1",
  "schema_version": 1,
  "source_binding": {
    "byte_length": 158742,
    "content_hash": "sha256:12da8e935906a731f06fc3729449063ddcd212a17c25b14c8e17938df8be212c",
    "extracted_text_hash": "sha256:fbb5828b6e8972f0600d65cd1a50060e267e545ce1ba034701d078c7a301fc96",
    "extracted_text_hash_recomputed": "sha256:fbb5828b6e8972f0600d65cd1a50060e267e545ce1ba034701d078c7a301fc96",
    "raw_bytes_hash_recomputed": "sha256:12da8e935906a731f06fc3729449063ddcd212a17c25b14c8e17938df8be212c",
    "raw_bytes_reverified": true,
    "source_record_hash": "sha256:eaf3bf77397455f269da6da61a3bfe6f615140b4577b5c9599e4554eb7ce4477",
    "source_record_hash_recomputed": "sha256:eaf3bf77397455f269da6da61a3bfe6f615140b4577b5c9599e4554eb7ce4477"
  }
}
