{
  "artifact_hash": "sha256:e7a692c2ed951139bc835a1f3660b561e8b193652332f9d4caf90739c3abf973",
  "artifact_kind": "persona_v3_ai_semantic_source_skeptic_review",
  "binding_checks": {
    "candidate_persona": {
      "detail": "extractor, acquisition, and skeptic catalog candidate/persona identities must match",
      "status": "pass"
    },
    "extracted_text": {
      "detail": "independent extraction hash, length, and page counts must match",
      "status": "pass"
    },
    "extractor_artifact": {
      "detail": "extractor artifact domain hash and structural validation must pass",
      "status": "pass"
    },
    "raw_bytes": {
      "detail": "source.bin byte length and SHA-256 must match acquisition and extractor bindings",
      "status": "pass"
    },
    "source_record": {
      "detail": "acquisition record canonical hash must match the extractor binding",
      "status": "pass"
    }
  },
  "candidate_id": "buffett_berkshire_letter_2024",
  "challenges": [
    "A machine semantic pass cannot establish method attribution or source grade."
  ],
  "extractor_binding": {
    "artifact_content_hash": "sha256:28ff24afaf1e96d1d81bfb8c86d83e52eb084f49cf7ea799c2202441d4cf4265",
    "declared_artifact_hash": "sha256:6837b358e0fa2983d2f99abdf1eaf5425602329ef00de098a7f9df5a8c3ed320",
    "proposition_count": 1,
    "recomputed_artifact_hash": "sha256:6837b358e0fa2983d2f99abdf1eaf5425602329ef00de098a7f9df5a8c3ed320",
    "relative_path": "master_buffett/buffett_berkshire_letter_2024.json"
  },
  "human_reviewed": false,
  "method_attribution_approved": false,
  "model_identity": {
    "agent_task_id": "/root/ai_formula_review_lane",
    "exact_deployment_id": "not_exposed_to_agent",
    "model_family": "GPT-5",
    "product": "Codex collaborating agent",
    "provider": "OpenAI"
  },
  "open_questions": [
    "Can independent human reviewers validate this source against the full method corpus?"
  ],
  "overall_verdict": "partial",
  "persona_id": "master_buffett",
  "pipeline_id": "alphacouncil_ai_semantic_source_skeptic_v1",
  "production_effect": "none",
  "prompt_identity": {
    "prompt_hash": "sha256:d24de73d6ec2305258b443de11570d1bd1feea4f15cdd0e21aa63c2a652539b9",
    "prompt_id": "alphacouncil.source-semantic-skeptic.round2.v1"
  },
  "proposition_reviews": [
    {
      "authorship_ambiguity": {
        "rationale": "The archived publication context is consistent with the proposed author, but this machine pass does not establish legal or editorial authorship.",
        "status": "limited"
      },
      "challenges": [
        "The evidence concerns five Japanese trading companies, not all investments.",
        "The word prefer and the ongoing acceptability condition are synthesized rather than quoted."
      ],
      "date_ambiguity": {
        "rationale": "The archive binds retrieval time and exact bytes, but no human-approved publication-date anchor is present in this lane.",
        "status": "limited"
      },
      "locator_verification": {
        "actual_page": 11,
        "actual_text_end": 777,
        "actual_text_start": 663,
        "declared_kind": "pdf_page",
        "declared_page": 11,
        "occurrence_count": 1,
        "section_label_status": "extractor_label_not_independently_bound",
        "status": "exact"
      },
      "open_questions": [
        "What narrower wording would be fully entailed by the cited excerpt alone?"
      ],
      "proposed_evidence_excerpt": "Our holdings of the five are for the very long term, and we are committed to supporting their boards of directors.",
      "proposed_locator": {
        "kind": "pdf_page",
        "page": 11,
        "section": "Japanese trading-company holdings",
        "text_end": null,
        "text_start": null
      },
      "proposed_statement": "Prefer very long holding periods for businesses whose governance and capital allocation remain acceptable.",
      "proposed_support_strength": "direct",
      "proposition_id": "buffett_berkshire_letter_2024:p1",
      "review_hash": "sha256:0cbd66d486f3a81a516794bf69a507083b93d3a5674fd532d1c830770acecd7a",
      "scope_ambiguity": {
        "rationale": "A case-specific holding intention is generalized into a portfolio-wide rule.",
        "status": "material"
      },
      "snippet_binding_status": "exact",
      "snippet_hash_claimed": "sha256:b53ae3c75dac7a8e955d6d371f3d40e01ce12e0b77af8cf0b9460437297df3da",
      "snippet_hash_recomputed": "sha256:b53ae3c75dac7a8e955d6d371f3d40e01ce12e0b77af8cf0b9460437297df3da",
      "support_rationale": "The excerpt directly establishes very-long-term intent for five named holdings; nearby text praises their capital deployment and management, but the proposed general conditional holding rule is broader than this case-specific statement.",
      "support_verdict": "partial"
    }
  ],
  "readability_recheck": {
    "extractor_status": "readable",
    "independent_status": "readable",
    "reason": "Independent extraction located every proposed evidence excerpt in readable text.",
    "status_match": true
  },
  "review_stage": "round_2_semantic_skeptic",
  "reviewed_on": "2026-07-27",
  "reviewer_kind": "ai",
  "role": "skeptic",
  "role_id": "ai_semantic_source_skeptic_v1",
  "schema_version": 1,
  "source_binding": {
    "byte_length": 64860,
    "content_hash": "sha256:ff21ab9407dec219757587b6ce6a1bf30e59cfff15bb21e81d1faaec7f97a8a7",
    "extracted_text_hash": "sha256:ec4ea26426b63b7b1756cdfd5d71267e84844e9f249363f966239ab8526e292d",
    "extracted_text_hash_recomputed": "sha256:ec4ea26426b63b7b1756cdfd5d71267e84844e9f249363f966239ab8526e292d",
    "raw_bytes_hash_recomputed": "sha256:ff21ab9407dec219757587b6ce6a1bf30e59cfff15bb21e81d1faaec7f97a8a7",
    "raw_bytes_reverified": true,
    "source_record_hash": "sha256:5a53b72e9270d858b6a397fa1216ca06656d4aef97e34dcf4a1f637b3e77befa",
    "source_record_hash_recomputed": "sha256:5a53b72e9270d858b6a397fa1216ca06656d4aef97e34dcf4a1f637b3e77befa"
  }
}
